title,link
Coronavirus: Oxford University vaccine trial paused after participant falls ill,https://www.bbc.com/news/world-54082192
Peru Locked Down Early. Now It Battles One Of The Worst Coronavirus Outbreaks,https://www.npr.org/2020/09/08/907084962/peru-locked-down-early-now-it-battles-one-of-the-worst-coronavirus-outbreaks
Is Israel on the cusp of complete coronavirus closure?,https://www.jpost.com/health-science/is-israel-on-the-cusp-of-complete-coronavirus-closure-641639
Silvio Berlusconi says he is fighting 'hellish' case of coronavirus,https://www.theguardian.com/world/2020/sep/09/silvio-berlusconi-fighting-hellish-case-coronavirus-italy
India coronavirus: Rumours hamper testing in Punjab,https://www.bbc.com/news/world-asia-india-54068007
Tom Hanks accused of getting special treatment after returning to Australia amid coronavirus quarantine,https://www.foxnews.com/entertainment/tom-hanks-coronavirus-special-treatment-australia-quarantine
AstraZeneca COVID-19 vaccine study put on hold due to suspected adverse reaction in UK participant,https://www.foxnews.com/health/astrazeneca-covid-19-vaccine-study-hold-adverse-uk
The latest on the coronavirus pandemic: Live updates,https://www.cnn.com/world/live-news/coronavirus-pandemic-09-09-20-intl/index.html
Air purifier that kills 99.9% of the coronavirus sees surge in global demand,https://www.cnbc.com/2020/09/08/coronavirus-air-purifier-that-kills-over-99point9percent-of-covid-19-sees-surge-in-demand.html
"Global food prices have been rising during the coronavirus pandemic, hitting food security",https://www.cnbc.com/2020/09/09/global-food-prices-have-been-rising-during-pandemic-hitting-food-security.html
